planet,shard,perpendicularity,investiture,system,featured_in
"Nalthis , Endowment, Awakening, Nalthian system, Cosmere, Warbreaker"
"Roshar , Honor Cultivation Odium[1], Honor's Perpendicularity Cultivation's Perpendicularity, Surgebinding Old Magic Voidbinding, Rosharan system[2], Cosmere, The Stormlight Archive"
"Scadrial , Preservation Ruin Harmony*, Well of Ascension Pits of Hathsin Ruin's Perpendicularity, Allomancy Feruchemy Hemalurgy, Scadrian system[1], Cosmere, Mistborn (series)"
"Sel , Devotion Dominion, The Lake Second perpendicularity[1], AonDor ChayShan Dakhor Forgery Bloodsealing, Selish system[2], Cosmere, Elantris The Hope of Elantris The Emperor's Soul"
"Ashyn , None current potential Investiture from Cultivation's past presence[1], Unknown disease-based, Rosharan system[2], Cosmere, The Silence Divine"
"Braize , Odium, Unknown, Rosharan system[1], Cosmere, The Stormlight Archive"
"Taldain , Autonomy, Sand mastery, Taldain system[1], Cosmere, White Sand"
"First of the Sun , None[1], Patji's Eye, Aviar, Drominad system[2], Cosmere, Sixth of the Dusk"
"Threnody , None current potential Investiture from Ambition's past presence, Shades, Threnodite system[1], Cosmere, Shadows for Silence in the Forests of Hell"
"Yolen , Unknown, Lightweaving Microkinesis, Cosmere, Dragonsteel"
"Vax , Unknown, Unknown, Cosmere, Unknown"
"Obrodai , Unknown, Unknown, Cosmere, Unknown"
"Earth (Alcatraz) , Council of Kings and Librarians, Alcatraz Versus the Evil Librarians"
"Earth (Rithmatist) , The Rithmatist"
"Earth (Reckoners) , Reckoners Multiverse, The Reckoners"
Earth (Legion) 
"Earth (Snapshot) , Snapshot"
"Earth (Skyward) , Cytoverse, Skyward (series) Defending Elysium"
